{
  "$schema": "../../../schema/guide.schema.json",
  "checkedOn": "2026-10",
  "title": "Keycloak as an OpenID Connect Provider for Casdoor",
  "headline": "Sign in to Casdoor with Keycloak",
  "summary": "Already run Keycloak? Add it to Casdoor as an OpenID Connect provider and people sign in to your Casdoor applications with their Keycloak accounts, while Casdoor handles the rest: other social logins, MFA, applications and permissions.",
  "steps": [
    {
      "title": "Create a client in Keycloak",
      "text": "In the Keycloak admin console, switch to the `{{realm}}` realm, open **Clients** and click **Create client**. Choose **OpenID Connect** as the client type, enter a client ID such as `casdoor`, and click **Next**."
    },
    {
      "title": "Turn on client authentication",
      "text": "Turn **Client authentication** on and keep **Standard flow** enabled, click **Next**, and fill in the login settings:",
      "fields": [
        {
          "label": "Valid redirect URIs",
          "value": "{{casdoorUrl}}/callback"
        }
      ]
    },
    {
      "title": "Copy the client secret",
      "text": "Save the client, open its **Credentials** tab and copy the **Client secret**. The client ID is the one you entered."
    }
  ],
  "tips": [
    "Keycloak matches redirect URIs exactly, so enter the Casdoor address people actually use, and avoid wildcards.",
    "Casdoor links each account to the Keycloak user ID (`sub`), so renaming a user in Keycloak doesn't create a second Casdoor account."
  ],
  "faqs": [
    {
      "question": "My Keycloak URLs have /auth in them. Does this still work?",
      "answer": "Yes. Keycloak 16 and older put `/auth` in front of every path; include it in the Keycloak URL, for example `https://keycloak.example.com/auth`."
    },
    {
      "question": "Can I use SAML instead?",
      "answer": "Casdoor also has a Keycloak SAML provider. OpenID Connect needs less setup on both sides, which is why this template uses it."
    }
  ],
  "sources": [
    {
      "label": "Keycloak OpenID Connect endpoints",
      "href": "https://www.keycloak.org/securing-apps/oidc-layers"
    },
    {
      "label": "Keycloak getting started",
      "href": "https://www.keycloak.org/getting-started/getting-started-docker"
    }
  ]
}
